"id","label","transcription"
"81ee5f85-d856a0ba.mp3","no-satire","político que circula desde hace varios días y que Arias Cañete ha puesto negro sobre blanco. Este fin de semana le preguntaban por ese pacto en una entrevista y decía que sí, que si es necesario habría que hacerlo. Elena Valenciano respondió poco después con este tuit. No hay ninguna posibilidad de coalición PSOE-PP. Cañete lo dice para hacer daño al PSOE. ¿No lo veis?"
"b3e3ee82-fb6b0f2a.mp3","satire","La hora. La hora, la hora del tiempo, hay que hacer las cosas. Como decía Vega, un día hemos madrugado porque luego venía lluvia, entonces había que volver antes de que llegase la lluvia. Otro día porque había ola de calor e iba a ser imposible."
"6cc0bd4c-8bfb9ed5.mp3","satire","Bueno, a ver, yo creo que es normal. Al final todos consumimos muchas series y muchas pelis de Estados Unidos. Vemos que nuestros héroes se mueren y nosotros también nos queremos morir, si es que es lógico. Yo lo veo bien en realidad porque creo que hay que probar de todo. La verdad es que cada vez más españoles están muriendo. ¿Pero creéis que es una moda pasajera o la muerte ha venido a España para quedarse?"
"fecd0c59-3bdf3a1b.mp3","no-satire","La última hora es que los antisistema alargan in extremis su decisión final. Retrasan del sábado 2 de enero al domingo 3 de enero su consejo político. Será en Barcelona y ahí deben decidir sí o sí, si ceden o no, si apoyan o rechazan a más, porque se agota el tiempo para investir un presidente en Cataluña que más de tres meses después de las elecciones sigue en funciones."
"3b8110a0-108d1a43.mp3","satire","Muy duro, ya llevábamos tiempo viendo grietas y nos esperábamos lo peor. Así que nada, el 4 de junio de 2021 declaro la casa en ruina, que teníamos ese fin de semana para desalojar a mi padre de su casa y yo de mi negocio y a la calle."
"a5ff67d8-29bf631d.mp3","no-satire","Joseph Williamson llegó a Liverpool de Warrington cuando tenía 11 años y encontró un trabajo en la firma de los Tate, los comerciantes de tabaco. Era muy ambicioso y ascendió rápidamente en la compañía y fue muy exitoso. Se casó con una de las hijas de Tate y se volvió extremadamente rico."
"73614e10-02bf0c45.mp3","no-satire","Los rebeldes insisten en que no se revele su ubicación exacta. Su principal experto ha sido arrestado tres veces. Las bombas caseras son un elemento importante de la lucha contra el gobierno sirio. Estos fabricantes de bombas viven en el taller. Las arman aquí y las llevan al otro lado de la frontera."
"62a6b94d-1a78f3bc.mp3","satire","Digo, si de 200, un hito que se nos cae entre tres gorditos. No, hombre. No, nada, casi no. Nos vemos en el VIPs que quieras. Yo no tengo bronca. Hasta en un talk, si quieres. Yo pago la cuenta, ¿no? Sí, no pasa nada. Vamos a un pequeño corte comercial y regresamos con los videos, porque ya ni hablamos de nada. Ahorita regresamos. Señora bonita, digamos de casa llegó el día más esperado, el día de jugar en Tudo o Tierra."
"a5e5091e-1814475a.mp3","satire","¿Cómo se puede cometer un atentado con un tensiómetro? Es que no lo podía tener con las pilas puestas. Claro, una vez tú decides hacer este coro, la gente no tiene ni idea de música, como por ejemplo yo. Viene aquí y dice, yo quiero cantar, hazme una estrella. Para cantar en un coro lo que hace falta es un poquito de oído."
"2f196ee9-43f2af54.mp3","no-satire","Científicos en Canadá encontraron que el salmón atlántico genéticamente modificado podría procrear con especies silvestres de similares características. Sin embargo, la empresa que creó el salmón minimizó los riesgos de cruce, ya que los peces que crían son hembras estériles."
"c1d4e13a-aba9e0d8.mp3","satire","Que para mí es todo lo anterior. Bueno, bien, señora, es evidente que para usted la ley de amnistía de Sánchez no debería existir, como las armas de destrucción masiva. De hecho, está muy activo movilizando a la gente contra esta ley. Bueno, esa es una cosa, voy a decir, es que como hombre de Estado, no creo que la amnistía sea una buena forma para acabar con el conflicto catalán."
"b52fabc1-66270d6b.mp3","satire","En pocos años nuestro automóvil será capaz de detectar obstáculos como ciclistas, animales o viejas. Sin embargo, de momento los prototipos son muy engorrosos y con poca autonomía, pues los cables que los unen al enchufe son todavía muy cortos."
"74514d76-91c92e20.mp3","satire","Esta historia me ha venido a la mente porque en nuestro país también hay quien lleva muy mal las críticas. Concretamente hablo de un buen número de miembros del Poder Judicial que parecen tener la piel sorprendentemente fina cuando se les critica y reaccionan con verdadera indignación cuando se habla de lawfare o utilización política de la justicia."
"f349b8a8-efae477e.mp3","no-satire","Antes podías comprar un M16 por 500 dólares. Desde hace dos meses cuesta 9.000. Nos cuenta este propietario. Parte de estos fusiles pertenecían a las tropas iraquíes, pero cayeron en manos de los kurdos Peshmerga cuando los iraquíes huyeron tras el avance de los terroristas. Los kurdos se hicieron con sus provisiones, que entraron en el imparable comercio de armas que defiende el norte de Irak."
"7a2f6843-a3e21b54.mp3","no-satire","El primer ministro chino, Li Keqiang, anunció en la reunión anual del Parlamento en Pekín que incrementará el gasto militar en más del 12% para alcanzar los 130.000 millones de dólares. El líder dijo que se harán ajustes estructurales dolorosos para mantener el crecimiento económico."
"c8ea826c-4ce37477.mp3","no-satire","Identificar a esos pasajeros sospechosos es una de las tareas prioritarias para los equipos encargados de averiguar qué ocurrió a bordo del aparato. La mayor parte de los 239 ocupantes eran de nacionalidad china. El gobierno de Pekín pide hoy a Malasia que acelere los trabajos de búsqueda, mientras a los familiares de los desaparecidos se les empieza a agotar la paciencia. Vamos hasta Pekín. Nuestra compañera Sara Romero está allí siguiendo el desarrollo de los acontecimientos. Sara."
"c9bab3de-811b8ac5.mp3","no-satire","Y hoy vamos a hablar de la sorprendente transformación de la actriz Renée Selweyer. Se ha operado la cara hasta el punto de no parecerse a sí misma. ¿Debe haber límites a las operaciones de cirugía estética? Esta es la imagen. El cambio es de tal calibre que podrían ser dos personas distintas. Algunos expertos consideran que hay líneas rojas que no se deben traspasar, aunque lo pide el cliente. Vamos a analizarlo."
"1e90f54e-2c3dc75f.mp3","no-satire","Sonia Castedo está imputada en dos casos de supuesta corrupción urbanística. Eso la inhabilita para ser candidata en las próximas elecciones municipales porque así lo tiene decidido su partido, el Partido Popular. Pero durante meses se ha resistido a las presiones de sus compañeros a pesar de los desplantes del presidente del PP valenciano e incluso del presidente del gobierno. Hoy la resistencia de Sonia Castedo ha llegado a su final. Vamos hasta Alicante, Joaquín Hernández."
"5d747f49-1571841a.mp3","satire","Y claro que en algún momento a todos nos llega esa nostalgia que nos recuerda cuando encontramos nuestro primer amor, cuando conseguimos nuestro primer trabajo, cuando cobramos nuestra primer quincena, en fin. Todas aquellas cosas que la edad, las responsabilidades o la rodilla mala nos impiden ahora. Así es, mis bebecitos, por supuesto que con esto nos referimos al señor romántico número uno de la lista de nuestros corazones, el licenciado."
"c78a2757-ab02dcb2.mp3","no-satire","El joven subsahariano trata de llegar a Nado, a Ceuta, pero le fallan las fuerzas. Agotado, se sujeta a una roca para coger aliento antes de intentarlo de nuevo. Cuando está a punto de hundirse, un agente de la Guardia Civil se lanza al agua y logra subirlo a la lancha semi-inconsciente. El inmigrante originario de Costa de Marfil fue trasladado al hospital de la localidad marroquí de Castillejos y ya ha recibido la alta médica."
"a9f32198-9fdab3df.mp3","no-satire","6.000 juguetes en todas partes del mundo son exhibidos en el Centro Cultural CES Pompeia en San Paulo. La muestra va desde muñecas de arcilla de Grecia hasta los más modernos dispositivos electrónicos, además de piezas brasileñas hechas a mano. Hasta el 2 de febrero, cada persona podrá encontrar un juguete para el niño que lleva dentro."
"9f70d06b-8291c6d6.mp3","no-satire","Frente a la costa de Mieres, en Asturias, continúa la búsqueda de los dos marineros que aún permanecen desaparecidos tras el naufragio del mar Noso. El pesquero se fue a pique con el mar en calma y sin dar señal de socorro. Las primeras investigaciones apuntan al hundimiento por un súbito desequilibrio de la carga al izar la captura. Ya había llegado a su cupo y era su último día faenando en los bancos de caballa."
"bc8057bb-291dd60c.mp3","satire","IKIPIXLY. AHORITA REGRESAMOS. YA ESTAMOS DE REGRESO. SON LAS 3 DE LA TARDE CON 15 MINUTOS EN LA RADIO DE LA REPUBLICA. SEÑORA BONITA, AMIGO, HOMOS DE CASA. LE ESTABAMOS PLATICANDO EN EL PRIMER BLOQUE ACERCA DE LA VIGILIA QUE TUVIERON LOS POPULARES DE LAVOZ DE MORENO POR EL ASESINATO DE 5 DE SUS MUCHACHOS. SANTO ESTABAN. NO, LAVOZ DE MORENO, LA VIGILIA. DIJE, ESCÚCHATE."
"42073de1-588bb030.mp3","no-satire","Con otras noticias, novedades relevantes para los inversores que acudieron a la salida a bolsa de banquia. La entidad ha anunciado esta mañana que devolverá todo el dinero invertido por los pequeños accionistas y con intereses. Los nuevos gestores quieren agilizar el proceso al máximo y esperan haber tramitado todas las solicitudes en un plazo de tres meses. Ana Estevez, ¿cuál es el procedimiento que tienen ahora para reclamar?"
"8e02393a-faa51ee6.mp3","satire","Este o no esté, estoy. Les saluda como cada día Chubel Torres. ¿Quién me acompaña? Nadie. Este programa lo hago solo yo. Este no se queda claro que no. Aquí está Gabriel Yemi, esto es Valdo Casares, está Ricky Moreno y todo el equipo que hace posible este maravilloso programa que llega hasta usted a través de las ondas gercianas de Radio Fórmula. Chicos, cada vez más."
"937948cf-54414110.mp3","satire","Pero el cuadro que Michael Jackson quería, ya sabéis, el que paga manda y cuanto más paga más mandas. A partir de ese momento, Jackson inunda de pasta al pintor a cambio de que le haga una serie de retratos como estos."
"7c4a5eda-f7bb6b50.mp3","satire","Caídas graciosas. O caídas graciosas, que es lo que la gente lee. Desde el 11 de septiembre y no recuerda ninguna. Ninguna. Ninguna especie. Ninguna. Un programa especial de caídas graciosas."
"ee983ef4-878ae04d.mp3","no-satire","Tensión en Venezuela por la ola de protestas y violencia que afecta al país. El líder del opositor partido Voluntad Popular, Leopoldo López, reapareció tras haberse emitido la semana pasada una orden de captura en su contra. Yo no tengo nada que temer, no he cometido ningún delito, he sido un venezolano comprometido con nuestro"
"d8693fc8-b87c40a7.mp3","no-satire","Miles de personas asistieron al funeral del adolescente palestino secuestrado y asesinado en aparente represalia por el asesinato de tres jóvenes israelíes. Mientras, Hamas, el grupo militante palestino ofreció poner alto sus ataques de cohete contra Israel si este detiene sus bombardeos contra Gaza."
"73bf3b72-8cf88cf4.mp3","no-satire","Al utilizar la violencia utilizaban el amedrentar a las personas que había dentro y seguramente el sobrino de esta señora le habría dicho ir allí, pegarle cuatro gritos, dos golpes en la mesa, inmediatamente van a cantar y te van a dar fundamental la contraseña de la caja fuerte, que ahí es donde está la clave del robo. José Félix, gracias por estar esta mañana con nosotros. Un placer."
"4c446fb4-6b32115b.mp3","no-satire","El primer ministro japonés, Shinzo Abe, advirtió que China había dado un peligroso paso al delinear una nueva zona de defensa aérea sobre las islas en disputa en el mar oriental de China. Pekín reiteró su derecho para establecer la nueva zona de identificación."
"6b571491-ec2e2cc1.mp3","no-satire","La capital de Nigeria abulla ese escenario de una manifestación que exige al gobierno más implicación en el caso de las 187 adolescentes que permanecen secuestradas. Las jóvenes fueron raptadas en un internado en un área remota del noreste del país hace más de dos semanas."
"f970eb44-d1d73f9e.mp3","satire","Es lo que tiene trabajar en televisión española, que haces así y consigues cualquier cosa. Bueno, si no eres Wyoming lo tienes más fácil. Esta noche en Documentos TV, el reportaje titulado Canta Autores. Qué rabia que dan, qué pesados que son. ¡Viva la rumba catalana! ¡Viva!"
"098724a1-f83be1a8.mp3","satire","Pues he comprado un libro de mujeres olvidadas. La revolución de las invisibles. Y he visto que hay bastantes libros sobre esa temática, lo cual me congratula porque eso significa que hay una reflexión de que las mujeres somos importantes y lo hemos sido siempre. Lo que pasa es que no nos han tenido muy en cuenta. ¿Se te está empezando a doblar ya la estantería? Pues sí, porque es que yo no compro nada electrónico."
"9015ac2b-a8145e89.mp3","no-satire","Una enorme explosión en una planta de fertilizantes en Texas, Estados Unidos, dejó docenas de casas y edificios destruidos, causando muertos y heridos. La explosión, que ocurrió en una pequeña localidad cerca de la ciudad de Waco, se produjo después de que se desatase un incendio en la planta."
"78bbf2a7-2467dfb7.mp3","no-satire","Frente a la sala Bataclan, el lugar donde se produjo la principal masacre, la llegada de gente es incesante. Como veis, la respuesta es muy buena, la gente está saliendo a la calle y yo me quiero apuntar también a dar un homenaje a cada punto. A pesar de la alerta máxima, la ciudad quiere retomar su pulso, eso sí, protegida por unas impresionantes medidas de seguridad."
"d67b0f00-82cb375b.mp3","satire","Así que, mientras nuestro amado líder sueña con cohetes y satélites, los mexicanos seguimos aquí esperando soluciones que deberían ser más básicas que la tecnología para explorar otros planetas. Porque antes de lanzarnos a conquistar el espacio, pues sería bueno asegurarnos de que en la Tierra las cosas marchen sobre ruedas."
"438ebe0c-5b7658bd.mp3","satire","Siguen en San Francisco todos los presidentes de este foro APEC y algo que destacamos el día de ayer es que el presidente se reunió con Xi Jinping para tratar diversos temas de educación, cooperación, le pidieron 26 mil equipos de enceros domésticos a los chinos para llevarlos allá a Acapulco. También pidieron que toque y rol. No, no, no, eso es Snoop Dogg, pero vamos más tarde a eso."
"dde35b5e-76047a2a.mp3","no-satire","Ya ves, acerca las navidades y hay que ir también pensando en cómo entretener a los chavales. Visitaremos la mayor feria de ocio infantil donde los pequeños y sus familias podrán encontrar diversión durante todo este puente festivo. En Dabadum pueden disfrutar de actividades deportivas, juegos artísticos, una zona de robótica e incluso aprender a doblar una serie de dibujos animados. Luego lo vemos."
"2879669d-afafc236.mp3","no-satire","Victoria Álvarez ha dicho en espejo público que la familia Puyol actuaba como un clan cuyo único objetivo era acumular riqueza. Recuerda como Jordi Puyol Ferrusola sacaba de Andorra bolsas de basura con billetes de 500 euros o como su madre Marta Ferrusola lo llamaba por teléfono para darle instrucciones."
"8c99125b-7d567891.mp3","no-satire","Más de 100 personas murieron y decenas resultaron heridas en China en el incendio de una planta de procesamiento de productos avícolas en el noreste del país. La agencia de noticias estatal Xinhua informó que la complicada estructura interna de los edificios y las estrechas salidas hacen los trabajos de rescate más difíciles."
"f0ccdd00-7d6d65fd.mp3","satire","Qué fuerte, qué fuerte, qué fuerte. Hemos pillado a Fernando Alonso con Raquel de Rosario, la cantante del sueño de Morfeo, que me recuerda a la oreja de Van Gogh, que está en el nombre, juntos. El asturiano y la canaria a menos de 100 km por hora. Dentro vídeo. Qué fuerte, Carmen, eres como una nadadora. Nada por delante y nada por detrás."
"ffc95443-ccefb867.mp3","no-satire","Dicen que Santa Claus entra en las casas deslizándose por las chimeneas, pero algunos usan otros métodos y llegan mojados. Este Papá Noel japonés sorprendió a los visitantes de este acuario, que se encontraron con un San Nicolás pasado por agua. Pero las rayas, tiburones y los más de 15.000 animales acuáticos que habitan en este complejo no mostraron mucho interés en la visita."
"d214d434-704ea01d.mp3","no-satire","Hemlis, que significa secreto en sueco, utilizará codificación de extremo a extremo para que los mensajes sean vistos solamente por quien los envía y quien los recibe. Zunde dice que esta es su respuesta al espionaje de datos por parte de los gobiernos. Sin embargo, Apple y WhatsApp afirman que sus comunicaciones ya están totalmente encriptadas."
"80c2ec4e-c8c17667.mp3","no-satire","El gobierno sirio y líderes de la oposición se sentaron cara a cara por primera vez desde el inicio del conflicto durante la Conferencia de Paz promovida por Naciones Unidas en Ginebra. El secretario general de la ONU, Ban Ki-moon, hizo un llamado a un diálogo que ponga fin a la guerra de más de tres años."
"339b80cc-501b0747.mp3","no-satire","...de José Antonio Martínez y de Gustavo Virués......que han sido rescatados......pero continúan en la parte alta de la montaña......ha sido un rescate muy difícil......porque el cañón en el que se encontraban......tiene pasillos de sólo 40 centímetros de ancho......ahora los cuerpos deben llegar a Ouarzazate......antes de ser repatriados......y hasta Allí, hasta Ouarzazate......han llegado esta tarde......los seis compañeros de expedición de los montañeros......para visitar y para abrazar......a Juan Bolívar, el único superviviente......a quien perdieron la pista..."
"e6f009fe-6b791eef.mp3","no-satire","Las autoridades interinas en Ucrania anunciaron que quieren arrestar al presidente de puesto Víctor Yanukovych por la muerte de manifestantes durante las protestas antigubernamentales. La orden surge después de la salida de Yanukovych del poder tras meses de protestas en reacción a un acercamiento a Rusia en detrimento de la Unión Europea."
"487253a9-2161eebf.mp3","no-satire","Naciones Unidas informó que la salida de un equipo de inspectores de armas químicas a Siria es inminente. El organismo explicó que el gobierno sirio aceptó las condiciones de la misión para determinar la existencia de armas químicas que tanto Damasco como los rebeldes se acusan de haber utilizado."
"cb13a494-1e3b51b0.mp3","satire","Pues miren, realmente la influenza siempre ha habido, nada más que estuvo dormidita dos años por lo del COVID, pero ahorita que el COVID ya medio bajó, pues ya regresó la influenza, ya regresó la influenza, y agárrense porque pues viene nueva ola, y pues si da doble, pues da más duro. Ya en Monterrey ya estaba obligatorio el coro de hojas otra vez. No tuvo nada que ver que yo anduve ya, no sé, así estaba ya. En el choque vimos en Puebla, ahí ya estaba la gente otra vez vacunada."
"d3051292-26cb3d09.mp3","no-satire","ha sido absolutamente descabezada, ha sido absolutamente desmantelada y está en sus manos efectivamente el que quieran formalizar o no su disolución. Pero de hecho, me atrevo a decir que prácticamente es el acta de función de esta. El ministro del Interior ha puesto de manifiesto la extraordinaria colaboración, dice, entre España y Francia en la lucha contra el terrorismo. Una colaboración que demuestra esta operación que aún no ha terminado y que podría saldarse con más detenciones."
"6426cdd9-6ca2b59a.mp3","no-satire","Era un poco más como el lejano oeste cuando me mudé. Ahora diría que es más corporativo y hay más reglas y normativas. Así que supongo que es un riesgo mayor hacer algo como esto, hacer fiestas clandestinas. Pero las recompensas son grandes. Quiero crear algo mágico y hermoso. Y quiero que la gente se sienta completamente transportada."
"617fed91-be25a716.mp3","no-satire","El empresario de informática estadounidense John McAfee aterrizó el miércoles en Miami tras ser deportado de Guatemala. El creador del antivirus McAfee es requerido por la justicia de Belice, donde vivió varios años, para ser interrogado sobre la muerte de un antiguo vecino."
"f208421a-635f7977.mp3","no-satire","La Corte Suprema de Estados Unidos escucha argumentos a favor y en contra de la Propuesta 8, la enmienda constitucional que impide el matrimonio gay en California. Si la declaran inconstitucional, el matrimonio entre personas del mismo sexo volverá a ser legal en California y eso podría extenderse a otros estados."
"5bd650eb-706a5d64.mp3","satire","O sea, de hecho, cuando querían promocionar Tenté Basteca algo, cabrón, lo ponían después de los... Ah, sí, claro. Porque el carry de Rey King era demasiado. Está muy cañón que... O sea, sí era, digo, un tema de marketing muy cañón. Y culturalmente nos pasó lo mismo a todos. No nos dejaban verlo y luego tus papás se hacen fans y ya te la pelaste. Hay un episodio que pienso mucho en él porque..."
"2bb2eafc-1d9fd600.mp3","satire","También he experimentado lo mío. Sí, sí, sí. Te recuerdo que soy el único de los dos que ha hecho un trío. ¡Joder! Sí, yo creo que a veces la cosa se despendolaba y se nos unía la fiesta a Durado Barroso. Eso está bien, hombre. Hay que ser modernos. Hay que ser LGTBIQ+."
"689c6886-f75325ff.mp3","no-satire","El servicio de mensajería WhatsApp ha anunciado un nuevo servicio de voz. Los usuarios pueden ahora mandar mensajes de voz sin límite de tiempo usando la aplicación en cualquier teléfono inteligente. WhatsApp genera dinero cobrando a sus usuarios 99 centavos de dólar al año. Esta nueva característica acerca a la aplicación a otras como Facebook Messenger, WeChat, Voxer y BBM, que ofrecen servicios similares."
"f9bd4469-43b9a93b.mp3","satire","Bienvenidos a este maravilloso programa donde derrochamos amor por los animales. Me cago en la leche. Qué pococina. Los amamos tanto que nuestro orden de prioridades está por encima de los concursantes. Sí, sí. Primero voy yo, después los bichos, luego los concursantes y por último María Jesús y su acordeón."
"8f8bfd4a-99d1e43b.mp3","satire","Yo no me siento utilizada por Pedro Sánchez. Yo siempre confié en el presidente del gobierno. Siempre he confiado y sigo confiando en más. Ahora confío que él, como presidente del gobierno de este país, es el que tiene que poner orden en esta situación. No más plazos, no más plazos de enmienda. La ley por el trámite de urgencia. Si alguien puede..."
"cdeda154-d6fc1310.mp3","satire","Oye, esto es un juego, ¿eh? ¿Empezamos? A ver, un momento, ¿está diciendo que esta cucaracha esmática puede ser mi padre? ¿Puede ser mi padre? ¿Tú no puedes ser mi padre? ¿Puedes ser nada? ¿Entiendes? Esto es pasapalabra, ¿vale? Ya, ¿no? En la cuarta parte de la tercera entrega del capítulo 8, se descubre que Sansón en realidad es hijo de Chihuahua."
"b6bb3419-8480bd14.mp3","no-satire","Hace tres semanas que no se producía esta imagen en la valla de Melilla. Cerca de 100 inmigrantes subsaharianos intentaron entrar en España. 21 lo han logrado, la mayoría después de momentos de mucha tensión y de violentos forcejeos con los cuerpos de seguridad del Estado. Unos 40 permanecieron varias horas encaramados a la valla."
"8119e8e9-e44dd128.mp3","satire","Muy buenas, bienvenidos a todos a este unboxing y testeo de un mini glue de reciclaje de eco vidrio. Tengo aquí ya la caja que tiene muy buenos acabados."
"b0b02222-5c87c0c2.mp3","no-satire","En el balcón del Ayuntamiento de Vilafranca del Penedés, a apenas 50 kilómetros de Barcelona, no ondea la bandera española. El 25 de septiembre, esta ciudad se declaró territorio catalán libre y soberano. La moción, aprobada por la mayoría de fuerzas políticas locales, pide al Gobierno de Cataluña que convoque un referéndum que literalmente prepare la transición hacia un nuevo Estado catalán."
"85d40134-a50056e9.mp3","no-satire","Murcia hace balance hoy de los daños causados por las lluvias torrenciales. En Cartagena cayeron más de 40 litros por metro cuadrado en apenas una hora. Los bomberos tuvieron que rescatar a muchas personas atrapadas por riadas dentro de sus vehículos y achicar agua de sótanos y bajos inundados. Tarea que aún continúan desarrollando. ¿No es así, Pablicara, en Cartagena?"
"fb9fa8f7-75bb85cd.mp3","satire","¡Ey! ¡Ey! ¡Ey! Y todos hemos escuchado la frase, el que se mueve no sale en la foto, y esta vez el que salió en todas las fotos y se cansó de promocionarse y anunciar a los cuatro vientos su destape, fue el diputado Sergio Pérez Garibay, cuyo mayor y tal vez único logro en el perro mundo es el papá de Checo Pérez."
"9861bcf5-57856efb.mp3","satire","Les estaba platicando acerca del primer bloque de esta difamación que pusieron ahí de un servidor que estaba atacando a un cierto hijo del presidente, cosa que no fue cierto, y pues se le dio su respectivo soplamocos aquí a la periodista irisa, pero la mayoría era hoy el presidente José Manuel López Valedor defendió el nombramiento de Clasectas."
"f529884e-49bee00f.mp3","no-satire","A pesar de haber desaparecido de los radares, el avión continuó mandando un ping de su ubicación cada hora, por siete horas después de la última comunicación con la torre de control. Eso sugiere que el avión se desplazó por uno de los dos corredores, norte o sur."
