"id","label","transcription"
"9a459265-ab26e8f0.mp3","satire","Un cirujano del Hospital Clínic de Barcelona interrumpió ayer una operación de trasplante de corazón para ver un videotutorial titulado Do it yourself, heart surgery project, parte 2."
"79929dae-809da06b.mp3","no-satire","Una escritura con tanto ímpetu no podía menos que reflejar una personalidad como la de Cervantes, un espíritu aventurero incluso temerario. Y ese hombre cuya caligrafía nos lo desvela, inteligente, impulsivo y astuto... ¡En un lugar de la mancha! ¿Cómo se habría enfrentado a sus grandes obras? ¡No puedo acordarme! Se podría casi afirmar rotundamente que las escribió del tirón a medida que se le iban ocurriendo las cosas y las ideas."
"d1d6dccb-4ec577e9.mp3","no-satire","Una jueza salvadoreña emitió el martes una orden de captura contra el expresidente Francisco Flores, quien ha sido acusado de malversación y enriquecimiento ilícito. También ordenó el embargo de los bienes del exmandatario, quien se cree se encuentra en Panamá."
"a6b066e3-6514e703.mp3","no-satire","Avanzan a buen ritmo los preparativos para la sucesión en el trono. Hoy además hemos sabido que los nuevos reyes harán una gira por España y por algunos países cercanos. Y algo importante, la Casa Real es partidaria de mantener algún tipo de aforamiento de protección judicial para don Juan Carlos cuando deje de ser rey. Estos son algunos de los detalles que hemos conocido hoy sobre los cambios que se preparan en Zarzuela y que no van a ser pocos. El oído de Dios."
"a4d8e2bf-eeef039b.mp3","no-satire","Y para demostrar con el ejemplo que no existe peligro de radioactividad... Fraga, ministro entonces de Franco, se bañó junto al embajador de Estados Unidos. Fue la versión que el régimen difundió del accidente de Palomares, el pueblo donde cayeron cuatro bombas termonucleares tras colisionar en el aire dos aviones estadounidenses."
"4d9ca28d-1320d2cb.mp3","satire","Sabes que todos los ojos están puestos también en Ferraz. ¿Has escuchado, por ejemplo, al líder de Vox, Santiago Abascal, pedir a las fuerzas de seguridad que no acaten las directrices de sus mandos? ¿Qué te parece a ti? Se supone que cuando juras tu cargo como policía, juras lealtad a España y lealtad a la Constitución. Y si están rompiendo la Constitución, pues lógicamente que les digan que no acaten las leyes, yo lo haría. Si fuera policía, me negaría."
"06e7c526-4ae0d042.mp3","no-satire","Se salió ayer sin que esa rueda de prensa de Puebla y Iglesias hubiese terminado ni tan siquiera y ya le dijo directamente Pablo no sabes dónde estás. El pacto PSOE podemos estar lejos, cerca. La prensa del día de hoy da por hecho que está cada vez más lejos incluso que han reventado la investidura de Pedro Sánchez."
"89f5ee82-71506398.mp3","no-satire","Y seguimos con Microsoft. La compañía está amenazando con bloqueos de por vida de las cuentas de los usuarios de Xbox Live que utilicen versiones piratas del juego Halo 4. Las versiones pirateadas solo pueden ser utilizadas en aparatos modificados para funcionar con contenido ilegal."
"42e454de-08ea4087.mp3","no-satire","La compañía de videojuegos Valve pospuso el lanzamiento de su propia consola hasta 2015. Por lo pronto, se espera que Valve se asocie a fabricantes de PC para lanzar computadoras orientadas a consumidores de videojuegos. La consola que preveía lanzar Valve era del tipo Steam Machine, pero tiene problemas con el dispositivo de control."
"58b749e2-c3a88eeb.mp3","satire","La de Carmen Jiménez es una historia de superación, pero que arranca con un terrible episodio de violencia de género. De esa cara y esa cruz queremos hoy hablar con ella. Carmen, muchas gracias por atendernos. Gracias a vosotras. Bueno, para entender bien tu historia hay que echar un poco la vista atrás. ¿Cómo era tu vida antes de la lesión medular?"
"3fbd4ec9-9e74a4d0.mp3","no-satire","La infanta Cristina y su marido Iñaki Urdangarín se reúnen en Barcelona con sus abogados. Lo hacen tres días después de que la audiencia de Palma decidiera mantener la imputación de la infanta por delito fiscal. Mientras tanto, el juez Castro no aclara aún si va a aplicar o no la llamada doctrina Botín."
"85f1b41b-fdd7b9c0.mp3","no-satire","Porque esto es lo de siempre, el progresismo malentendido que es una falacia para hacer negocio de las mujeres a las que nos están borrando en todos los órdenes de la vida. Bien, pues esos países culturalmente evidentemente tienen un choque con nosotros. Entonces, evidentemente que hay personas excepcionales que vienen de Marruecos, que han venido de Palestina, me han criticado los de Vox, que no te imaginas por decir eso cuando yo he sido la máxima defensora de Israel y lo sigo siendo."
"f8133c90-d230c18f.mp3","satire","¿Por qué estoy viendo Sailor Moon? Porque, a ver, no nos hagan los pendejos De niños sí era muy de la caricatura de niñas Y la caricatura de niños No había punto intermedio Y Sailor, o sea Y luego ya cuando empezaron a hacer Sailor Moon Porque Sailor Moon lo pasaban en Caritele Y era de, bueno, pues ya pasan las cabezas de Zodíaco Y bueno, podría haber Sailor Moon Podría haber Sailor Moon Se transformó a Halo"
"d7b7dadf-848b965b.mp3","no-satire","¿Qué tal? Buenas noches. Putin no cede respalda a sus seguidores en el este de Ucrania y asegura que no espera tener que hacer uso de su derecho a enviar sus tropas a la zona. En una comparecencia televisiva y a preguntas de los espectadores no le importó hablar de lo que denominó la nueva Rusia, donde ya entra la anexionada región de Crimea y recordó a Europa que él tiene la llave del suministro del gas."
"31e390b5-8a4eb521.mp3","no-satire","Buenos días a todos. Sus primeras palabras han sido en español quizá como un gesto con el que intentar reconducir los roces de la última semana. El comisario de Asuntos Económicos fue desautorizado por el presidente de la comisión al adelantar que España no cumpliría su objetivo de definir. Hoy, Moscovici repite. Hay riesgo de que España no cumpla las previsiones de estabilidad y de crecimiento."
"f9b08c74-7e232c0e.mp3","satire","Con agua, ¿no? Con agua, con paredes y suelo. Tú ya tienes tus paredes, tú ya tienes tu suelo. Llena cualquier apartamento, cualquier habitación de agua dejando un trocito para sacar la cabeza y respirar. Y ya tienes tu propia piscina."
"d8c4516c-407064dc.mp3","satire","Con Félix Bolaños. Sí, hombre, sí, hombre, se me va a llenar esto de indeseables. Que empiezo dejando pasar a Bolaños y se me acaba colando Pablo Casado. No. Hombre, a ver, no se ponga así. Es miembro del gobierno y encima es madrileño. Que le recuerdo que ha invitado a Feijó. Que lo más cerca que ha estado de la Moncloa es cuando pasa por la Seixca Minorense."
"3e811caf-2cc1284d.mp3","no-satire","En esta ocasión, los científicos están midiendo la presión del viento en la réplica a escala de un edificio real. El objetivo es ayudar a crear estructuras más resistentes para que no se repita lo que ocurrió en 1992, cuando el huracán Andrew dejó daños por 25.000 millones de dólares en el estado."
"67443976-f0bfcdba.mp3","no-satire","Siete de cada diez conductores mayores de 65 años aseguran sentirse más lentos e inseguros al volante. A pesar de esto, reconocen que cogen el coche casi a diario. Y aunque se haya renovado el carnet, lo recomendable para este tipo de conductores es evitar los viajes largos, la conducción nocturna y también en condiciones climatológicas adversas."
"c81aa3d5-0827c872.mp3","no-satire","Pero primero, una exposición de obras del artista británico Mark Quinn se puede ver en la Galería White Cube de Hong Kong. Llamada Detenido por el Deseo, explora cómo el deseo da forma a nuestro universo y afecta la relación de la humanidad con la naturaleza. Quinn transporta al espectador a un mundo hecho de elementos crudos y aparentemente místicos."
"cc50f424-823fc8f8.mp3","no-satire","Esta es la última operación de este cirujano antes de sumarse al grupo de otros nueve especialistas en una misión a Vietnam sin fines de lucro. Aterriza en el aeropuerto de Da Nang, donde los estadounidenses rociaron esta arma química. Científicos descubrieron que la contaminación del suelo es 350 veces por encima de los niveles seguros."
"adcdb1c5-47a4a34a.mp3","satire","Bueno, es un lío, me he liado, porque yo estaba mirando que las elecciones en América eran como seis horas más tarde que aquí, y en las de madrugada, y digo, pues me voy a Londres que es solo una."
"239e2847-108173c5.mp3","satire","¿Cómo un rey y una reina? Sí, tenemos un rey. Tenemos un rey. ¿O tal vez es una reina? No, tienes un rey. Vale. Después de la coronación, escuché que Charles iba a visitar, iba a hacer una ruta de ruta alrededor del Reino Unido y las tierras que tendrá ahora. ¿Va a ir a Benidorm?"
"f5c30ca7-3dd729ab.mp3","no-satire","Un país sumergido en una profunda crisis económica donde el aumento del movimiento neonazi ha creado una atmósfera de temor para muchos inmigrantes. Algunos carecen de documentación correcta como este inmigrante sirio que fue encarcelado y ahora enfrenta la deportación."
"0366cd84-f7138323.mp3","satire","No lo sé. Por empezar, habría que empezar a hacer encuestas. Llevamos diez años sin encuestas del SIS, encuestas oficiales sobre la monarquía, sobre la valoración de los miembros de la familia real. Aquí es casi un tabú. Nadie quiere preguntar porque quizá tienen miedo a cuál es la respuesta."
"f84deabd-2c758198.mp3","satire","Para que cuando haga calor lo pueda levantar y pues me dé un poco de aire. Que te dé el aire. Porque bajar la ventanilla no te sirve. No. Y pasa humo. El humo se te mete por la ventana y ya es difícil que salga. Pero en cambio con... El descapotable pasa por ahí, ¿no? Sí. Bueno, no es mal argumento, ¿eh? Cuando tengáis coche, porque te sé algún día yo creo que tú tendrás coche..."
"b2e40cd2-cdef0f21.mp3","no-satire","Me ha dado dos ejemplos, pero la convergencia con Izquierda Unida ha fracasado en la mayoría de municipios, salvo Coruña, Pontevedra, Zaragoza, Bilbao y Barcelona. Para nosotros la convergencia es algo que no se hace con partidos, que se hace desde abajo. Y en ese desde abajo puede haber gente que milite en partidos y nosotros encantados, pero los que pensaron que en una reunión entre dirigentes en despacho se pueden llegar a acuerdos, no han comprendido cómo nos gusta trabajar en Podemos."
"a889fe6c-3288efbf.mp3","satire","¿Qué llega una vez al año y hace que los españoles lloren y pierdan los nervios? Exacto, Eurovisión, pero también la declaración de la renta. Vamos a ver si este debate nos sale a pagar, a devolver o, lo más probable, a discutir. Vamos a hablar de la declaración de la renta, ese gran momento. ¿Cómo afrontáis"
"226825b7-3ef5a02c.mp3","satire","No, porque no tienen sindicato que les represente, pero, tranquilas, hermanas hormigas, he hecho un proceso de escucha y vamos a convertir el hormiguero en una república democrática y a mandar a la hormiga reina a Abu Dhabi. Bueno, bueno, ya empezamos con las directrices. Vamos a hacer una pausa de unos segundos. Seguimos en unos segundos."
"df2d2bfa-43791bcd.mp3","satire","que habiéndome arrebatado mi derecho fundamental al amor de mis compañeros socialistas y a los 500 euros de dieta. A ver, José Luis, José Luis. Esto ya está. Mira, camisas limpias, huellito almidonado y de paso te he metido los bajos de un pantalón que lo ibas arrastrando más que el caso Delsi. No te ríes."
"0dbb9c84-8052fae8.mp3","satire","barra baja FG barra baja F1 880165 barra baja filtro como suena barra baja 1.XML"
"0293b4eb-56bd923e.mp3","satire","Y ya está, o sea, a mí esta cosa frívola de ir cambiando de... No, es que ahora me cambio de piso, pues bueno, yo no lo entiendo. ¿Sabéis? Si queréis ser woke, pues bueno."
"78e2bba9-0a4160fc.mp3","no-satire","Están los ánimos en Villar de Cañas. Alcalde y vecinos han unido fuerzas y han creado una plataforma de lucha contra la zona de protección que quiere establecer el gobierno regional. Insisten en no entender los argumentos. Esto que van a ver a continuación es lo que nos decía el alcalde sobre la supuesta existencia de empresas interesadas en instalarse allí en Villar de Cañas. Con una condición, eso sí, parar el proyecto del cementerio nuclear."
"b26cfe76-c48c13a9.mp3","satire","Presentó imágenes térmicas y datos duros de medición de aire que demuestran cómo esta infraestructura está afectando ecosistemas con gases como metano, benzeno y otros contaminantes solamente presentes en dos bocas y en el cesto de basura de León Larregui. Ante esta situación..."
"3fda468e-16df3c3d.mp3","satire","cierto amigo de nosotros no quiere decir que es valdó de una amiga que traía gomitas con caché tech es esa mierda yo 0 me drogo yo no aguanto los dos y entonces dije agua y estoy con el víctor con esos putos semana proteger y quizás que todo mundo comió tantita y yo yo también"
"82a61659-2408a730.mp3","no-satire","Y otro asunto destacado de esta misma tarde, la Audiencia Nacional vuelve a imputar al exjefe de la Casa del Rey, a Rafael Espotorno y también a otros 11 exdirectivos por el caso de las tarjetas Black. Hoy se ha admitido a trámite un recurso que da marcha atrás a la decisión de suprimir la causa. Vamos hasta la Audiencia Nacional en directo, Carmen Ferrero, ¿qué implica esa decisión?"
"d964579a-3244d61a.mp3","no-satire","No hay planes A, B, C, D y E. Solo hay uno, que es votar. Artur Mas reitera que su único plan es convocar el referéndum del 9 de noviembre. Otro de sus consejeros en el gobierno asegura que la vicepresidenta seguía órdenes del presidente catalán cuando dijo que no habrá consulta este año si el constitucional rechaza la eventual ley de consultas."
"00d79f7b-f88e545a.mp3","no-satire","Son imágenes que quedan ya para la historia del fútbol. Brasileños de todas las edades, de todas las condiciones, aficionados, futbolistas, todos lloran ante su peor pesadilla. Era difícil imaginar algo más difícil de asumir que la derrota de Brasil en la final del Mundial de 1950 frente a Uruguay en Río de Janeiro, aquel famoso maracanazo. Pero lo de anoche, lo de anoche ha sido aún peor."
"4844e306-8845cb97.mp3","satire","Esta historia, o sea, no esta, la de la... Se repite hasta completar esos 564... Ya quítame esto. 564 millones, ¿qué nos está costando a todos? Que el presidente pueda decir que cumplió una de sus pendejadas y promesas de campaña. 564 millones de pesos en solo nueve meses, güey. El mismo tiempo que le toma a Inés Gómez Montt mandar a la chingada el conteo del Inegi de su cuadra, güey."
"99230654-34dc466d.mp3","satire","Hay gentes del PP y de Vox y otros con aspecto extraño que ondean raras banderas y llevan el brazo en alto. ¿Y qué hizo el bello Pedro? Contadlo presto, amo mío. Dejadme que yo os ayude. Traed, que os sujeto el vino. ¡Traed acá!"
"8c48189b-9c07f081.mp3","no-satire","Estos animales son conocidos por su increíble sentido del olfato y sus afiladas garras, que pueden perforar concreto. Se dijo que los animales iban a ser transportados a China. Allí quizás iban a ser sacrificados para obtener su carne y sus escamas, que algunos creen pueden mejorar el rendimiento sexual. Ahora permanecerán en Tailandia, donde serán rehabilitados y posteriormente liberados."
"f9626d52-2a1aae23.mp3","no-satire","Más noticias. La policía de Tenerife localiza más de 1.300 kilos de hachís después de una persecución que empezó por saltarse un semáforo en rojo. En su huida, los narcotraficantes empezaron a arrojar fardos de hachís para reducir el peso de este vehículo, pero al final acabaron estrellándose contra la mediana de una autopista. Los dos ocupantes han sido arrestados."
"ba71e77f-63c91066.mp3","no-satire","Los populares reiteran las palabras de Rajoy. No apoyarán con su abstención un gobierno de Sánchez y Ciudadanos. Y ahora que quiere ser el presidente del gobierno, venga a nosotros a pedirnos ayuda. Sinceramente, creo que los españoles merecen un respeto y se me lo permite el Partido Popular también. Consideran que la peor opción es una coalición entre socialistas, Podemos e independentistas. Antes que eso, prefieren nuevas elecciones."
"82e31394-7f919fcf.mp3","no-satire","Era mejor que lo dejara porque no era bien visto o porque iban a decir los demás. No te podés lastimar, entonces no te vas a poder poner una pollera, querés parecerte un hombre, desconfiando de la orientación sexual. Pero después eso con el tiempo también fue cambiando, ¿no? Y yo creo que mi familia está muy orgullosa hoy de lo que hago."
"bdd8a5a7-ee8b2fa6.mp3","satire","Quizá muchos se vean obligados a trabajar. Muchos se van a ver entre la espalda y la pared y van a decir, bueno, voy a tener que probar qué es esto del trabajo. Pensemos en esas consecuencias. Va a haber gente, rentistas, caseros, que por primera vez en su vida..."
"2e5f3f09-e2e0d8d0.mp3","satire","Sumergidos en esta borracha de frenesí frenético descubrimos el santuario de calzados más íntimos, zapatos estrechos, encarnación, tu dueña no revela el secreto mejor guardado de su establecimiento."
"219aa2f3-ee64eaf2.mp3","no-satire","Las imágenes de esa búsqueda las están viviendo también las familias de las víctimas y a la indignación por el crimen se suma ahora la desesperación de las informaciones que les llegan sobre las tareas de rescate de los cuerpos. Familias que quieren repartir y repatriar a sus muertos cuanto antes y que quieren que la investigación llegue hasta el final. Algunos se dirigen directamente a Putin. Escuchad."
"367a5b51-78b2a08c.mp3","satire","El futuro ya está aquí. Mañana Cataluña activará el nivel de emergencia por sequía en 200 municipios, incluida Barcelona. El consumo de agua se reducirá a 200 litros de agua por habitante. A ver, que tampoco está mal. Probablemente es más agua que la que ha consumido Boris Johnson en toda su vida."
"f5a845c0-88aee157.mp3","no-satire","La sorprendente historia de un embarazo está detrás del histórico acuerdo entre Cuba y Estados Unidos. Verán, uno de los prisioneros cubanos, este hombre, preso durante 16 años fuera de su país, recuperó la libertad y se encontró con su mujer embarazada. El espía liberado es ahora un héroe nacional en Cuba. Enseguida les mostramos las explicaciones que dan desde La Habana y desde Estados Unidos a este asunto."
"7449d937-d97f5b45.mp3","no-satire","Este es un desastre creado por el hombre, no es un desastre natural. La minería ilegal es la razón detrás de esto. La falta de cuidado está detrás. No podemos sentarnos y no hacer nada. El gobierno continuará tomando todas las medidas para proteger las vidas y el bienestar de la gente."
"ef0ad9ee-6b0e6586.mp3","no-satire","El rublo se recupera ligeramente, en su cotización más baja de la historia después de una intervención masiva del Banco Central de Rusia. También rebota la bolsa de Moscú en medio de mucha volatilidad en los indicadores. La economía rusa sigue afrontando una grave crisis, golpeada por la bajada del precio del petróleo y por las sanciones internacionales provocadas por el conflicto de Ucrania."
"31788278-0d2266f9.mp3","no-satire","La agencia de noticias Associated Press acusó al gobierno de Estados Unidos de llevar a cabo una intrusión masiva en sus actividades de recolección de noticias. Funcionarios estadounidenses anunciaron una investigación penal tras conocerse que el Departamento de Justicia obtuvo en secreto registros telefónicos en 2012."
"8d6197fa-851cd2d1.mp3","no-satire","Sabra es el mayor fabricante de hummus en Estados Unidos. Produce 4.000 toneladas al mes y se espera que las ventas superen los 750 millones de dólares este año. Con la apertura de esta fábrica en Virginia, la empresa necesita una fuente local de garbanzos."
"7d85df55-e6da91bd.mp3","no-satire","El nuevo brazo permite realizar una serie de funciones hasta ahora no conseguidas. Su complejo sistema de sensores es capaz de detectar contracciones del músculo del hombro que el brazo robótico traduce en movimientos reales. Pero va más allá y su sensibilidad permite manipular objetos muy frágiles sin miedo a que se rompan."
"8612e89e-640831ee.mp3","satire","Lenia lleva apenas unos meses en el puesto y desde que llegó ha intentado confrontar a los demás ministros para, según ella, desenmascarar el sistema judicial, como dice AMLO. Pero lo único que ha logrado desenmascarar es que no acabó la prepa. Y esta vez no fue la excepción, porque tuvo un enfrentamiento directo con la presidenta de la corte y mujer que abandonaron sus papás en unas coladeras de Ciudad Gótica, Norma Piña."
"775684dc-d659eb3a.mp3","satire","En la entrada hay un cambio que es muy"
"b1045bea-744a080f.mp3","no-satire","El presidente de Estados Unidos, Barack Obama, defendió el uso de aviones no tripulados en lo que llamó una guerra justa en defensa propia y afirmó que esta campaña había hecho de Estados Unidos un lugar más seguro. En un discurso sobre su política de seguridad, el mandatario también anunció medidas encaminadas al cierre del centro de detención en Guantánamo."
"c3ff2ce1-0dc6de5d.mp3","no-satire","Seguidores y opositores del depuesto presidente de Egipto, Mohamed Morsi, salieron a las calles en el primer viernes de oración desde que comenzó el Ramadán. Los hermanos musulmanes siguen incitando a la población a que proteste por el regreso de Morsi, que fue derrocado por el ejército la semana pasada."
"1d80aed4-dbc23692.mp3","no-satire","La idea detrás de la arquitectura chola es que debe representar dos cosas, las tradiciones indígenas aymaras y sobre todo, la riqueza de sus dueños. Así como la primera expresión ha sido el comercio informal y la segunda ha sido el baile, yo creo que la arquitectura es la tercera, es la tercera forma de decir yo soy"
"6e5495a4-558048d1.mp3","no-satire","Para San Valentín la gente compra chocolate y cosas de color rojo. La semana de los Oscars la gente busca estar bella. Se trata de actores y actrices que quieren lucir su mejor rostro. Las fotos quedan ahí para la eternidad."
"4a5c71c0-2127cad6.mp3","no-satire","La policía ha detenido a un matrimonio por intentar matar presuntamente a su hijo de dos meses en Zaragoza. El bebé ingresó en el hospital con múltiples contusiones y fracturas. Los agentes investigan también la muerte de otra hija de la pareja de apenas 26 días en abril del año pasado en circunstancias similares. Además, se les ha retirado la custodia de otra niña de dos años. Silvia Zanz tiene los detalles."
"afe1036e-5be20a03.mp3","satire","Jorge Javier, no silbes y aplícate planchando mis camisas AR para que no quede ni una sola arruga. Tus deseos son órdenes, diosa televisiva. Estas blusas van a quedar con menos arrugas que tu cara."
"de9fc55d-44c011ff.mp3","no-satire","Nicaragua y Colombia recibieron de forma diferente el fallo de la Corte Internacional de Justicia sobre la disputa de soberanía que mantienen ambos países en el Caribe. Mientras el presidente colombiano Juan Manuel Santos habló de omisiones y errores, su homólogo nicaragüense Daniel Ortega aceptó el fallo."
"54cbe894-5ef71d2b.mp3","satire","No, yo creo que por lo que se ha dicho, por los espacios en los que transitan gente de prensa de Kamala Harris, el disparo de Trump sí fue significativo para ella porque no le dispararon a ella."
"b06f2342-a00a4d92.mp3","satire","Y se pusieron detrás efectivamente de un cristal, de una mampara. Muy valientes, ¿no? Donald Trump no repite, Donald Trump no comete dos veces el mismo error, a contrario que Estados Unidos, que podría volver a cometer el mismo error dos veces votándole a él en masa este noviembre. La misma mampara que tenemos en casa en la ducha, porque una vez nos dispararon en la ducha y pusimos mampara."
"ee33563f-f5ad4546.mp3","no-satire","Al barrio londinense de Brixton no llegan los turistas y allí es donde un uruguayo ha puesto en marcha un interesante proyecto una cooperativa que instala paneles solares en viviendas sociales Mi nombre es Agamemnon Otero, nací en Uruguay y de chico fui a Nueva York"
"49c6a879-56d3d161.mp3","no-satire","Para la celebración se planea una semana de música y eventos de baile especiales y también se prepara un libro que refleja la colorida historia de un escenario que mantuvo a los berlineses bailando incluso durante las épocas más oscuras de la ciudad. Cien años después es todavía un lugar popular que atrae a locales y extranjeros con ganas de bailar toda la noche."
"8400b8f4-624ebe48.mp3","satire","publicación ahora bonita amigo vamos de casa le estamos platicando en el primer bloque como pues paso ahí lo del debate de la gobernadora de la Domex en el que la señora Delfina Gómez dijo es que no puede cuando podrá usted en el mero concierto de Rosalía ese mero día obviamente bueno si se va a armar nadie lo va a ver porque todos estamos viendo a la Rosalía bueno el rollo es yo no pensaba ir yo si me voy a aventar al debate"
"b6b98132-faf80361.mp3","no-satire","Dos aerolíneas japonesas dejaron en tierra su flota de 24 aviones Boeing 787 Dreamliner luego de que una de las aeronaves realizara un aterrizaje de emergencia. Las autoridades de aviación en Estados Unidos ordenaron una revisión del modelo debido a una serie de problemas que ha sufrido en las últimas semanas."
